path,sentence
common_voice_hy-AM_39477593.wav,Բազմաշերտ քարայրների համալիր է։
common_voice_hy-AM_39477594.wav,"Միկոնին հայտնի է ոչ միայն թատերական դերերով, այլև, հիմնականում, որպես հեռուստադերասանուհի։"
common_voice_hy-AM_39477595.wav,"Սրանցով առավել հարուստ են վարդազգիների, հնդկացորենազգիների, լոբազգիների ընտանիքներին պատկանըղ բույսերը։"
common_voice_hy-AM_39477616.wav,Թարգմանել է հայ քնարերգության նմուշներ։
common_voice_hy-AM_39477618.wav,"Նաև հանդիսանում է կազմակերպության անդամ, որը պայքարում է բնապահպանության համար։"
common_voice_hy-AM_39477619.wav,Արդյունագործածական նշանակությունը այնքան էլ մեծ չէ։
common_voice_hy-AM_39477620.wav,Արդյունքում՝ այգին կորցրեց իր նախնական տեսքը։
common_voice_hy-AM_39477621.wav,Կոնցենտրիկ լուծույթները առաջացնում են կոլոիդ լուծույթ՝ «հեղուկ ապակի»։
common_voice_hy-AM_39477636.wav,Ամենահետաքրքրականը դեռ առջևում է։
common_voice_hy-AM_39477637.wav,"Արտադրվում է բրդյա գործվածքներ (թվիդ), կա տուրիզմ։"
common_voice_hy-AM_39477639.wav,Ծայրահեղ անկայուն բույս է։
common_voice_hy-AM_39477640.wav,Այդ համակարգի անբաժանելի մասն է համարվում կոնվեյերը։
common_voice_hy-AM_39477651.wav,Մեծ արագության ճնշման և ջերմաստիճանի խիստ բարձրացման պատճառով առաջանում է պայթյուն։
common_voice_hy-AM_39477653.wav,Եկեղեցին պատկանում է նեոգոթիկ ոճին։
common_voice_hy-AM_39477655.wav,Վերջնական արդյունքի հիմքում ընկած էր դեմո ձայնագրությունը։
common_voice_hy-AM_39477657.wav,Ներկայացման մեջ առաջնայինը պետք է լիներ բարոյականության թեման։
common_voice_hy-AM_39477660.wav,Ի սկզբանե թանգարանի պատկերասրահները չունեին ներկայիս տեսքը։
common_voice_hy-AM_39477678.wav,"Քննադատները հոլովակն անվանել են բավականին տարօրինակ, սակայն հետաքրքիր։"
common_voice_hy-AM_39477679.wav,Բելգիական բանակն ասպատակել է քաղաքը։
common_voice_hy-AM_39477680.wav,"Խիստ զարգացած են կտրիչները, որոնք աճում են կենդանու ամբողջ կյանքի ընթացքում։"
common_voice_hy-AM_39477690.wav,Ես օգտագործեցի այս համերգը՝ հարգանքի տուրք մատուցելու համար։
common_voice_hy-AM_39477691.wav,Այնուհետև աշխատանքի է անցել իր ալմա մատերում՝ որպես դասարանային տիկին։
common_voice_hy-AM_39477692.wav,Գոյություն ունի նաև լաբորատորիա խմիչքի շարունակական մոնիտորինգի և վերլուծության բնութագրերի համար։
common_voice_hy-AM_39477711.wav,Փիլիսոփայի հայացքներում հիմնական գաղափարը «ասաբիան» է։
common_voice_hy-AM_39477712.wav,"Նպատակն էր ճարտարապետ դառնալ, սակայն նիւթական միջոցները թոյլատրելու չէին։"
common_voice_hy-AM_39477713.wav,Նրանց ստեղծումը կապված է կավի սալիկների վրա սեպագրով գրելու հետ։
common_voice_hy-AM_39477715.wav,Պոլիտկովսկայան բազմիցս մեկնել է ռազմական գործողությունների վայրեր։
common_voice_hy-AM_39477717.wav,Սակայն այն հետաձգվեց տեղումների պատճառով։
common_voice_hy-AM_39477887.wav,Կրամշիի մտածումները տարբեր եղած են բազմաթիւ համայնավարներու գաղափարներէն։
common_voice_hy-AM_39477888.wav,Գիրքը իր մեջ պարունակում է նաև պատմական իրադարձություններ լատիներենով։
common_voice_hy-AM_39477890.wav,Միջուկը կարող է լինել ինչպես աղի այնպես էլ քաղցր։
common_voice_hy-AM_39477891.wav,Շների՝ գորշ գայլի հետ ունեցած գենետիկական կապը կապված է խառնածնության հետ։
common_voice_hy-AM_39478102.wav,- Նա ցնցվեց և համարյա սարսափած հանկարծ նայեց Աննայի դեմքին:
common_voice_hy-AM_39478103.wav,Հայրը ակտիվ մասնակցություն է ունեցել իր վեց երեխաների դաստիարակման գործում։
common_voice_hy-AM_39478104.wav,"Բնադրում են ծառերի, ժայռերի վրա, աֆրիկականը և հնդկականը՝ գաղութներով, ճավայականը՝ զույգերով։"
common_voice_hy-AM_39478105.wav,"Կառույցը երկու գմբեթով փոքրիկ մատուռ է, ունի զանգակատուն։"
common_voice_hy-AM_39478106.wav,"Նա ցնցվեց, կանգ առավ և ականջ դրեց:"
common_voice_hy-AM_39478107.wav,"Հրապարակում է գտնվում նախագահի պալատը, պերճաշուք հյուրանոցներ։"
common_voice_hy-AM_39478108.wav,"Նորմալ պայմաններում եթերային հոտով և քաղցր համով անգույն, ցնդող հեղուկ է։"
common_voice_hy-AM_39478109.wav,Դիրքավորումը հիմա չի համարվում սովորական մարքեթինգային գործունեություն կամ ռազմավարություն։
common_voice_hy-AM_39478110.wav,Հայտնի է որպես հոգևոր երաժշտական գործիքներ օգտագործող առաջին խմբերից մեկը։
common_voice_hy-AM_39478111.wav,"Մշակում են հացարմատ, բրինձ, շաքարեղեգ։"
common_voice_hy-AM_39478122.wav,Մկիվան սովորաբար ստեղծագործում էր ջազային երաժիշտների օրինակով։
common_voice_hy-AM_39478123.wav,Նաև ունեին ցածր արտագաղթի ցուցանիշ։
common_voice_hy-AM_39478124.wav,Հռոմն այստեղ հանդես եկավ վերոնշյալ պետությունների պաշտպանությամբ։
common_voice_hy-AM_39478125.wav,Կյանքի վերջին տարիներին ստեղծել է նաև սրբապատկերներ։
common_voice_hy-AM_39478126.wav,Նույն թվականին էլ նա սկսել է աշխատել նկարի վրա։
common_voice_hy-AM_39478127.wav,Ալեքսանդրը տարված էր նաև ասֆալտի հոկեյով։
common_voice_hy-AM_39478128.wav,Նա միանգամից երկրպագուների ուշադրության տակ հայտնվեց իր ցուցադրած լավ խաղով։
common_voice_hy-AM_39478129.wav,Այս շրջանի կենտրոնը գտնվում է կոորդինատներում։
common_voice_hy-AM_39478130.wav,Աննան վճռականորեն պաշտպանել է իր անմեղությունը։
common_voice_hy-AM_39478131.wav,Դավիդի ագրեսիան վրդովմունք էր առաջացրել մի շարք բնիկ շոտլանդացիների մոտ։
common_voice_hy-AM_39478157.wav,"Ավելի ուշ եկեղեցին վերածվել է մզկիթի, հետո էլ վերածվել է ամբարի։"
common_voice_hy-AM_39478159.wav,Քիմիական հետազոտություններով զբաղված գիտնականներին անվանում են քիմիկոսներ։
common_voice_hy-AM_39478160.wav,Ունին սուր տեսողութիւն։
common_voice_hy-AM_39478161.wav,Կորիզի ծակոտկենությունը կապ է հաստատում ցիտոպլազմայի և կորիզանյութի (կարիոպլազմա) միջև։
common_voice_hy-AM_39478167.wav,Զաւէնը չորս զաւակներէն երրորդն էր։
common_voice_hy-AM_39478168.wav,Փոխադրումների հիմնական մասն իրականացնում են տաքսիները։
common_voice_hy-AM_39478169.wav,Արաբական օրիքսը հեշտորեն ընտելանում է անապատային կյանքին։
common_voice_hy-AM_39478170.wav,Շների մարմիների ջերմությունը փոփոխվում էր ամբողջ թռիչքի ժամանակ։
common_voice_hy-AM_39478171.wav,Գծանկարը համարյա նույն չափի է՝ ինչ բնօրինակը։
common_voice_hy-AM_39478191.wav,"Ժամանակի ընթացքում, իսպանական ուղղագրությունը վերադարձավ այն ձևին, ինչպես եղել էր նախկինում։"
common_voice_hy-AM_39478193.wav,Գրականության և արվեստի բնագավառի մրցանակներ են սահմանվել նաև արտասահմանյան երկրներում։
common_voice_hy-AM_39478194.wav,"Ինչպես ցանկացած այլ ագռավ, ավստրալական ագռավը ամենակեր է։"
common_voice_hy-AM_39478195.wav,Ըստ երևույթի՝ իր աստղադիտակի տեսադաշտի փոքր լինելու պատճառով։
common_voice_hy-AM_39478201.wav,բայց իմ ասած հայ երիտասարդներին էլ ճանաչում եմ՝ ինչպես հարկն է:
common_voice_hy-AM_39478202.wav,Խալիֆայությունը ջանում էր սրել այն։
common_voice_hy-AM_39478203.wav,- Դուք ինձ չե՛ք սիրում…
common_voice_hy-AM_39478204.wav,Բաղաձայնական համակարգը երկաստիճան ձայնազուրկ է։
common_voice_hy-AM_39478205.wav,Հայրենական մեծ պատերազմի մասնակից։
common_voice_hy-AM_39478211.wav,"Ունի կարողություններ, որոնք կարողանում են շահարկել տեխնոլոգիան։"
common_voice_hy-AM_39478212.wav,Նրա այս աշխատանքները վերջնականապես խարխլեցին վիտալիզմի մասին եղած պատկերացումները։
common_voice_hy-AM_39478213.wav,Մոտակայքում կար աղահանք։
common_voice_hy-AM_39478214.wav,Սովորել և ավարտել է նաև նույն ինստիտուտի ասպիրանտուրան։
common_voice_hy-AM_39478215.wav,Ունեցել է փոքր դերեր տարբեր հեռուսատասերիալներում։
common_voice_hy-AM_39478216.wav,"Ունի տեկտոնական ծագում, ցածրադիր մակերևույթ և ծովային դարավանդներ։"
common_voice_hy-AM_39478217.wav,"Գրիգորն սկսեց կիսաձայն կարդալ, նայելով մերթ գրքին, մերթ Մարթային և մերթ երեխային:"
common_voice_hy-AM_39478218.wav,Սիդնեյի տեսարժան վայրերից է։
common_voice_hy-AM_39478219.wav,Նրան տեսնելով՝ բոլորը զարմանում են։
common_voice_hy-AM_39478228.wav,Քաղաքը հանգստավայր է։
common_voice_hy-AM_39478231.wav,Մի քանի տարի էլ աշխատել է զոդման արտադրամասում։
common_voice_hy-AM_39478238.wav,Բարեբախտաբար որոշ ժամանակ անց երկուսն էլ ազատ են արձակվել։
common_voice_hy-AM_39478239.wav,Ֆրանսիացիներն ասես լեգեոնը հնարավորինս թուլացնելու գործելակերպ էին որդեգրել։
common_voice_hy-AM_39478240.wav,"Նրա կարծիքով՝ չկա որևէ փաստագրական ապացույց, որ նրանք սիրեկաններ են եղել։"
common_voice_hy-AM_39478241.wav,Օսլոն հայտնի է իր քանդակներով։
common_voice_hy-AM_39478251.wav,Նաև հաջողվազ է նրա բիզնեսը սպորտային ապրանքների ոլորտում։
common_voice_hy-AM_39478253.wav,Մարմնի նկարչությունը կարող է արտահայտվել ոչ միայն նկարելու միջոցով այլև գրելու։
common_voice_hy-AM_39478255.wav,Դա թատրոնի վերջին խաղաշրջանն էր նախկին շենքում։
common_voice_hy-AM_39478256.wav,"Աշխատել է էստամպի ոլորտում և հաստոցային գրաֆիկայում (մատիտ, ածուխ, չինական տուշ)։"
common_voice_hy-AM_39478266.wav,Ճանապարհը դժվարանում է ոտքի վնասվածքի պատճառով։
common_voice_hy-AM_39478268.wav,Շատ դեպքերում չափայնությունը հնարավորություն է տալիս կապ հաստատել համապատասխան մեծությունների միջև։
common_voice_hy-AM_39478269.wav,Տեղացիներն արձանի համար կառուցել են փոքրիկ մատուռ՝ երկրպագության համար։
common_voice_hy-AM_39478270.wav,"Պատմվածքի սկզբում ընթերցողը չի հասկանում, թե ում անունից է տարվում շարադրանքը։"
common_voice_hy-AM_39478287.wav,Բլոկի դաշտերում պատկերված էր ռուսական եռագույնը և գրվածք։
common_voice_hy-AM_39478288.wav,"Բացի կարճամետրաժ անիմացիաներից, ստուդիան նաև նկարահանում է երաժշտական տեսահոլովակներ։"
common_voice_hy-AM_39478289.wav,Այն իրենից ներկայացնում է հերոսի գրանիտե կիսանդրի։
common_voice_hy-AM_39478290.wav,Փետրավոր ամպերը երկրի մակերևույթ հասնող տեղումները չեն առաջացնում։
common_voice_hy-AM_39478291.wav,Օբուխովան ռուս վոկալ դպրոցի նշանավոր ներկայացուցիչներից է։
common_voice_hy-AM_39478295.wav,Նախիջևանի երկրամասի մեծ մասն ամայացավ։
common_voice_hy-AM_39478299.wav,"Սունկն ունի սպիտակ պտղամիս, թիթեղներ և ոտիկ։"
common_voice_hy-AM_39478311.wav,Որոշ ժամանակ անց թեթև անձրևը լվանում է մշակաբույսերը։
common_voice_hy-AM_39478312.wav,Նրանք գործընկերներ դարձան և շուտով սիրահարվեցին իրար։
common_voice_hy-AM_39478314.wav,Ունի երկու հիմնական բարբառ՝ վերշիկվար և բուրուշասկի։
common_voice_hy-AM_39478315.wav,Օրիգինալ արձանը կորավ։
common_voice_hy-AM_39478321.wav,"Հիշողության գործընթացներն են մտապահումը, պահպանումը, վերարտադրումը և մոռացումը։"
common_voice_hy-AM_39478323.wav,Ցանքը կատարում են մարտին։
common_voice_hy-AM_39478325.wav,Մանուկ և պատանի հասակում այցելել է երկրի տարբեր մարզեր։
common_voice_hy-AM_39478334.wav,«Հակահարվածի» անդամներին մի քանի անգամ բերման են ենթարկել ոստիկանանակն բաժանմունք։
common_voice_hy-AM_39478335.wav,Հետագայում ալգորիթմը սահմանում է միայն ենթադրվող իմաստներից ամենաակնառուները։
common_voice_hy-AM_39478336.wav,Ծնվել է հրեա մտավորականների ընտանիքում։
common_voice_hy-AM_39478337.wav,Կենդանաբանական այգու տարածքում կազմակերպվում են քաղաքային շրջանային տոներ։
common_voice_hy-AM_39478338.wav,"Նա անգլիացի առաջին պոետն է, որ սոնետներ է գրել։"
common_voice_hy-AM_39481520.wav,Պատանեկության տարիներին նա աշխատում էր մոդել իր համայնքում։
common_voice_hy-AM_39481521.wav,Պատերազմին աւարտին ընտանիքը նօրէն վերադարձաւ։
common_voice_hy-AM_39481539.wav,Շատ քիչ տեղեկատվություն կա նրանց մասին։
common_voice_hy-AM_39481541.wav,"Սնվում է ընձյուղներով, ծաղիկներով, բողբոջներով, հատապտուղներով։"
common_voice_hy-AM_39481543.wav,Այնտեղ էլ թաղվել է։
common_voice_hy-AM_39481580.wav,Օպերայի գործողությունները տեղի են ունենում հետևյալ պատմական իրադարձությունների ֆոնին։
common_voice_hy-AM_39481581.wav,Իշխանաձորցիները հայնտի էին իրենց քաջությամբ։
common_voice_hy-AM_39481582.wav,Կինոյում նկարահանվելով հանդերձ՝ դերասանուհին շարունակում է իր աշխատանքը տիկնիկային թատրոնում։
common_voice_hy-AM_39481583.wav,Իոսիֆ եղած է ընտանիքի հինգ երեխաներէն ամէնակրտսերը։
common_voice_hy-AM_39481601.wav,Այս առումով նրան համարում են «կենդանի բրածո»։
common_voice_hy-AM_39481602.wav,"Նրանք սխալմամբ օգտագործելով ալկոհոլ՝ ջրի փոխարեն, հայտնվում են ծառի ճյուղի վրա։"
common_voice_hy-AM_39481603.wav,"Աշունին երկրորդ ամիսն է, այգեկութքի աւարտը։"
common_voice_hy-AM_39481611.wav,Եղբոր երեխաները խաղում էին բակում մյուս երեխաների հետ:
common_voice_hy-AM_39486941.wav,Կառավարությունը բաղկացած էր տասնութ նախարարություններից և ութ առընթեր մարմիններից։
common_voice_hy-AM_39486943.wav,Լաց էր լինում և Խոնարհի քույրը:
common_voice_hy-AM_39486946.wav,Ռուսաստանի նկարիչների միության անդամ։
common_voice_hy-AM_39486948.wav,Դպրոցի հիմնադրումից մինչև իր մահը նա հանդիսացել է դպրոցի տնօրենը։
common_voice_hy-AM_39486951.wav,"Հանակարգչային անիմացիան կարող է փոխարինել կասկադյորներին, ինչպես նաև դեկորացիաներին։"
common_voice_hy-AM_39487806.wav,"Պարամետրական տատանումները հնարավոր են ինչպես էլեկտրական, այնպես էլ՝ մեխանիկական տատանողական համակարգերում։"
common_voice_hy-AM_39487807.wav,Վրեժխնդրության տեսարանը խաղարկվում է ստորգետնյա ավտոկայանատեղիում։
common_voice_hy-AM_39487809.wav,Սերունդի եզակի տեսակ։
common_voice_hy-AM_39487811.wav,Վերջին մարտը ֆիլմի շարունակությունը։
common_voice_hy-AM_39487813.wav,"- Ես այդ չեմ ասում, ասում եմ…"
common_voice_hy-AM_39487841.wav,Նա քննադատական հոդվածների և գրախոսությունների հեղինակ է։
common_voice_hy-AM_39487842.wav,"- Շնորհավոր Նոր տարի, աղջիկս,- արտասանեց դողդոջուն ձայնով, գրկեց ինձ և համբուրեց ճակատս:"
common_voice_hy-AM_39487843.wav,"Ռեցիայի բնակչությունը զբաղվում էր անասնապահությամբ, գինեգործությամբ և մասամբ հողագործությամբ։"
common_voice_hy-AM_39487847.wav,"Փհենյան համարվում է երկրի վարչական, մշակութային և պատմական կենտրոնը։"
common_voice_hy-AM_39487872.wav,Եղել է շատ ճանաչված և հարգված բժիշկ։
common_voice_hy-AM_39487874.wav,Առասանի դանակն առասանը կտրող հարմարանքներից առաջին և առավել հայտնի տարատեսակն է։
common_voice_hy-AM_39487875.wav,"Աչքերը միջին չափի են, միշտ մուգ։"
common_voice_hy-AM_39487877.wav,Մարգահովիտում ամենուրեք կան մրգատու ծառեր և կարտոֆիլի ու կաղամբի բանջարանոցներ։
common_voice_hy-AM_39487880.wav,կնոջս վրա էլ ընկնում է հանցանքը:
common_voice_hy-AM_39488211.wav,"- Իրա՞վ,- ուրախությամբ կանչեց Բարսեղը:"
common_voice_hy-AM_39488212.wav,"Բնակիչներն զբաղվում են թեյի մշակությամբ, այգեգործությամբ, բանջարաբուծությամբ և անասնապահությամբ։"
common_voice_hy-AM_39488213.wav,Նախորդի պես այս արշավանքը ևս պսակվեց անհաջողությամբ։
common_voice_hy-AM_39488215.wav,"Հայության հիմնական զբաղմունքը հողագործություն, անասնապահությունն ու արհեստագործությունն էր։"
common_voice_hy-AM_39488292.wav,Ժամանակակից արվեստաբանության հիմնադիրն է։
common_voice_hy-AM_39488293.wav,Սևահողային տափաստանները մեծ մասամբ հերկված են։
common_voice_hy-AM_39488294.wav,Առանց այն էլ աղքատ ընտանիքը հայտնվել է ավելի ծանր կացության մեջ։
common_voice_hy-AM_39488295.wav,Այն ներառում էր պատերի մոնտաժված մասերի նկարները։
common_voice_hy-AM_39488315.wav,Ասերը եղել է միջազգային մասնավոր իրավունքի առաջատար իրավագետ։
common_voice_hy-AM_39488317.wav,"Համայնքն ունի գյուղապետարան, կա բուժաշխատող։"
common_voice_hy-AM_39488318.wav,"Ծաղիկները քառատիպ են, պսակաթերթերը՝ սպիտակ կամ թեթևակի վարդագույն։"
common_voice_hy-AM_39488319.wav,"Եղած է նաեւ քանդակագործ, վիմագրիչ, ներկամատիտի նկարիչ, փորագրիչ եւ գծագրիչ։"
common_voice_hy-AM_39488321.wav,Պատանեկության տարիներից սկսել է բանաստեղծություններ գրել։
common_voice_hy-AM_39488363.wav,Այս տվյալները կարող են փոփոխվել ուղեգրի արժեքից։
common_voice_hy-AM_39488366.wav,Տարբեր երկիրներու մէջ այս տօնը տարբեր օրերու կը նշուի։
common_voice_hy-AM_39488368.wav,"Թույլ է տալիս իրականացնել ինչպես թռիչքներ, այնպես էլ վազք։"
common_voice_hy-AM_39488369.wav,Կոերցիտիվ ուժի մեծությունը պայմանավորված է նյութի ջերմաստիճանի և ներքին կառուցվածքի փոփոխություններով։
common_voice_hy-AM_39488370.wav,Պատերի նշանակալի հաստության պատճառով լարումների բաշխումն ըստ հաստության զգալիորեն անհավասարաչափ է։
common_voice_hy-AM_39488371.wav,Անտալամին ազդվել է հարավֆրանսիական արձանագործությունից։
common_voice_hy-AM_39488372.wav,"Մերուժանը զբաղվում էր նկարչությամբ, շվի էր նվագում և երգում էր։"
common_voice_hy-AM_39488373.wav,Արփիարը իրավագիտական կրթություն է ստացել ռուսական համալսարաններից մեկում։
common_voice_hy-AM_39488418.wav,Ապրանքանիշը իր նոր բիզնես ռազմավարությամբ առաջիկայում կունենա բարձր թռիչքներ։
common_voice_hy-AM_39488420.wav,Բիոտան էկոհամակարգերի կարևոր մասն է։
common_voice_hy-AM_39488422.wav,"Դրսից լսելի եղավ հնչակի անընդհատ, դողդոջուն ձայնը, և նույն րոպեին ներս մտավ իմերել սպասավորը:"
common_voice_hy-AM_39488423.wav,Այս ծրագրով հնարավոր կլիներ նաև պաշտպանել հայոց հարավային սահմանները։
common_voice_hy-AM_39488425.wav,Նկարիչը ստեղծել է նաև ջրաներկ աշխատանքներ կենցաղային և ազգագրական թեմաներով։
common_voice_hy-AM_39488451.wav,"Արդեն բավական է, հասկանում եք, պետությունը ի վիճակի չէ բոլորի սոցիալական խնդիրները լուծել:"
common_voice_hy-AM_39488452.wav,"Գրված է երկսյուն,միասյուն, բոլորագրով, նոտրգրով։"
common_voice_hy-AM_39488454.wav,"Ճանապարհային նշանները, չկարողանալով տանել տղայի այդ արարքը, դաս են տալիս նրան։"
common_voice_hy-AM_39488557.wav,Թթվածինն անհրաժեշտ է բույսերի շնչառության և մանրէների կենսագործունեության համար։
common_voice_hy-AM_39488558.wav,"Սահմանանշանների խախտումը, դրանց փչացումը, պղծումը դիտվել է ծանր հանցագործություն։"
common_voice_hy-AM_39488559.wav,վախենում ես հարբես և վաղն անպետք դառնաս գործի համար:
common_voice_hy-AM_39488560.wav,Ջոզը հսկայական հասակով և երկաթյա ատամներով տղա էր։
common_voice_hy-AM_39488561.wav,Որոշ տեխնոլոգիական փուլեր լիովին դադարել են գոյություն ունենալ կամ փոփոխվել են։
