path,sentence
common_voice_hy-AM_26078953.wav,Ժաբոն օձիքի տարատեսակ է։
common_voice_hy-AM_26078954.wav,Հետպատերազմյան շրջանում դարձել է պրոֆեսիոնալ լրագրող։
common_voice_hy-AM_26078955.wav,Ան նաեւ աջակցած է բժիշկներ առանց սահմաններու կազմակերպութեանը։
common_voice_hy-AM_26078956.wav,Մասնակիցները հնարավորություններ են փնտրում աշխատանքները շարունակելու համար։
common_voice_hy-AM_26078957.wav,Ժամանակ առ ժամանակ եղել է կենտրոնացված իշխանություն։
common_voice_hy-AM_26079004.wav,Այս թեմատիկայով ստեղծված առաջին հուշարձանն է աշխարհում։
common_voice_hy-AM_26079005.wav,Նրա պատանեկության մասին քիչ է հաղորդվում։
common_voice_hy-AM_26079006.wav,"Ճակատային պատերի համար օգտագործված են կոպտատաշ, իսկ թաղի համար՝ սրբատաշ քարեր։"
common_voice_hy-AM_26079007.wav,"Մզկիթը գործածվում էր որպես պալատ, իսկ գմբեթը ծառայում էր եկեղեցուն։"
common_voice_hy-AM_26079008.wav,Թանգարանը ունի բժշկական հին գործիքների լայնածավալ հավաքածու։
common_voice_hy-AM_26079239.wav,"«Աստվածածնա պարը» դանդաղ, հանդիսավոր պար է։"
common_voice_hy-AM_26079240.wav,Ճապոնիայից դուրս այս տարբերությունը ավելի քիչ նշանակություն է ստացել։
common_voice_hy-AM_26079241.wav,"Աննա կը տիրապետէր՝ էսթոներէնին, ռուսերէնին, ֆրանսերէնին, անգլերէնին եւ գերմաներէնին։"
common_voice_hy-AM_26079242.wav,Ես նույնպես կարոտում եմ խմբի բոլոր անդամներին։
common_voice_hy-AM_26079243.wav,Քրիստոս կրնար հեշտութեամբ իր վրայ գրաւել մարդոց ուշադրութիւնը։
common_voice_hy-AM_26079328.wav,Շինությունն ունի երեք մուտք։
common_voice_hy-AM_26079329.wav,Երկրորդ շվատումը կատարվում է լրիվ ծաղկումից անմիջապես հետո։
common_voice_hy-AM_26079330.wav,Ճանապարհին նրանք բազմաթիվ արկածներ են ունենում։
common_voice_hy-AM_26079331.wav,Կիկվիտը առևտրական և վարչական կարևոր կենտրոն է։
common_voice_hy-AM_26079332.wav,Երկրորդ համաշխարհային պատերազմից հետո այստեղ զարգացել է տուրիզմը։
common_voice_hy-AM_26079422.wav,Լիզան պետք է ընտրի՝ ո՞ւմ հետ է պատրաստ կապել իր կյանքը։
common_voice_hy-AM_26079423.wav,Խիզախ դալմատին է։
common_voice_hy-AM_26079424.wav,"Խաչգյուղի շրջակայքում պահպանվել են միջնադարյան եկեղեցի, խաչքարեր և գյուղատեղիներ։"
common_voice_hy-AM_26079425.wav,Հետաքրքրասեր է. վտանգի պահին թաքստոցից դուրս է նետվում՝ հեռացնելու թշնամիներին։
common_voice_hy-AM_26079426.wav,Իսկ ավելի ուշ ստացել է բժշկական դոկտորի կոչում։
common_voice_hy-AM_26099929.wav,"Չափազանց չորադիմացկուն է, լուսասեր, ոչ պահանջկոտ հողի նկատմամբ։"
common_voice_hy-AM_26099930.wav,Եկեղեցին մեկ քահանա ուներ։
common_voice_hy-AM_26099931.wav,Նա եղել է խմբի ամենաերիտասարդ մասնակիցը։
common_voice_hy-AM_26099932.wav,Բուսական և կենդանական աշխարհը լավ է զարգացած։
common_voice_hy-AM_26099934.wav,"Այն, ըստ էության, արտահայտում է հենց այդ կրոնափիլիսոփայության տարածման բնույթը։"
common_voice_hy-AM_26099986.wav,Ոչ մի ուրիշ երկիր այդքան հաճախ չի ներկայացված եղել։
common_voice_hy-AM_26099987.wav,"Ունի հաստ մաշկ, հսկա գլուխ։"
common_voice_hy-AM_26099989.wav,"Բյուզանդացիները աջակցեցին իշխանին, սակայն պարտություն կրեցին։"
common_voice_hy-AM_26099990.wav,"Զբաղվում էին հողագործությամբ, այգեգործությամբ և անասնապահությամբ։"
common_voice_hy-AM_26100021.wav,Դրա արդյունքներով վճարումների գումարը կազմել Է մեկուկես միլիարդ դոլար։
common_voice_hy-AM_26100022.wav,Սպիտակավիզ արագիլը հանդիպում է զույգերով կամ փոքր խմբերով ջրային տարածքների մոտ։
common_voice_hy-AM_26100023.wav,Ստեղծագործել սկսել է վաղ տարիքից։
common_voice_hy-AM_26100024.wav,Լեռնաշղթաները սովորաբար անվանում են բլուրներ կամ լեռներ՝ կախված չափից։
common_voice_hy-AM_26100025.wav,Երգը բազում անգամներ հայտնվում է գրքերում և սերիաներում։
common_voice_hy-AM_26100200.wav,Քաղցրահամ է և սառնորակ ջուր ունի։
common_voice_hy-AM_26100201.wav,Սնվում է բույսի արմատներով։
common_voice_hy-AM_26100204.wav,Առաջին համաշխարհային պատերազմի ժամանակ խփել է թշնամու ինը օդանավ։
common_voice_hy-AM_26185054.wav,Սովորել է տեղի միջնակարգ դպրոցում։
common_voice_hy-AM_26185055.wav,"Հազվադեպ է լինում, որ միայն մեկ աչքն է տուժում։"
common_voice_hy-AM_26185056.wav,"Պապիկը հանքային ինժեներ է, ինչպես նաև ռազմական օդաչու։"
common_voice_hy-AM_26185057.wav,Այդ պատճառով համայնքը դժվարությամբ է կազմակերպում գյուղմթերքների արտադրությունը։
common_voice_hy-AM_26185058.wav,Տղայի ստացած առաջին կրթությունը եղել է պապիկի հսկայական գրադարանի գրքերի ընթերցումը։
common_voice_hy-AM_26185100.wav,"Այդ նկարներից մի քանիսը, նույնիսկ անցել են նյարդաբանության դասագրքեր։"
common_voice_hy-AM_26185101.wav,Բենի խաղը նկատվել է քննադատների կողմից և արժանացել է լավ կարծիքների։
common_voice_hy-AM_26185102.wav,Ակումբի հիմնադրման հստակ տարեթիվը հայտնի չէ։
common_voice_hy-AM_26185103.wav,Նա ինքը նկարագրել է այդ հրավերը հավաքական «մեծ անակնկալ»։
common_voice_hy-AM_26185157.wav,Լինում են նաև եկեղեցու անունը կրող սրբի պատկերով խաչվառներ։
common_voice_hy-AM_26185158.wav,Սահմանի հակառակ կողմում նույն պատկերն է։
common_voice_hy-AM_26185159.wav,Այդ պատճառով նրանք փորձում էին անցյալը բերել իրենց ժամանակաշրջանի պատմության մեջ։
common_voice_hy-AM_26185160.wav,Խումբն ելույթ է ունենալու երգի անգլերեն տարբերակով։
common_voice_hy-AM_26185161.wav,Մուրադը երկար ժամանակ գտնվում էր իր հարազատների հսկողության տակ։
common_voice_hy-AM_26185168.wav,Այս օրինակը ցույց է տալիս թեգն ընտրելու երկու տարբեր մեթոդ։
common_voice_hy-AM_26185171.wav,Այն մեծ պահանջարկ ուներ հարևան շրջաններում։
common_voice_hy-AM_26185172.wav,Երբեմն նույնացվում են վիճակի երգերի հետ։
common_voice_hy-AM_26185173.wav,Ադրբեջանի ժողովրդական նկարիչ։
common_voice_hy-AM_26185174.wav,"Եվ մայրը, և հայրը ոստիկանության աշխատակիցներ էին։"
common_voice_hy-AM_26185175.wav,Նրա ժամանակ աշխարհագրությունը գիտական տեսակետից գտնվել է անբավարար վիճակում։
common_voice_hy-AM_26185176.wav,"Հետագայում նա հրաժարվում է բացատրել, թե ինչպես է արել այդ ամենը։"
common_voice_hy-AM_26185208.wav,Մորգանը այդ ժամանակներից մինչև այսօր խաղում է կենտրոնական պաշտպանի դիրքում։
common_voice_hy-AM_26185209.wav,Խաղալով կատուն և երեխաները իրերը վերադարձնում են իրենց տեղը։
common_voice_hy-AM_26185210.wav,"Անկախ նրանից, թե որտեղ ես դու, ես քո տանն եմ։"
common_voice_hy-AM_26185211.wav,Եկեղեցին գտնվում է գյուղի կենտրոնում։
common_voice_hy-AM_26185212.wav,Շատ քննադատներ ջերմորեն ողջունեցին սերիայի չորրորդ գիրքը։
common_voice_hy-AM_26253023.wav,Իսկ բուսականութեան եւ կենդանական համակարգային ընթացքը կ՛աշխուժանայ։
common_voice_hy-AM_26253024.wav,Նրանք իրենց օրերն անցկացնում են ծաղկած այգում և դառնում անբաժան ընկերներ։
common_voice_hy-AM_26253025.wav,Սովետական սահմանապահի մոտ եկել էր հարսնացուն։
common_voice_hy-AM_26253026.wav,Հեղինակի գրքերի հիմնական ընթերցողները կանայք են։
common_voice_hy-AM_26253027.wav,Աստվածաշնչում ասորի մասին հիշատակվում է երեք անգամ։
common_voice_hy-AM_26253033.wav,Անվան նշանակությունը վիճելի է։
common_voice_hy-AM_26253035.wav,Նրանք ապաստան են գտնում ձկնորսական հյուղակում և ստիպված էին սպասել այնտեղ։
common_voice_hy-AM_26253037.wav,Մայր գետին միանալուց առաջ անցնում է համանուն գետի մոտով։
common_voice_hy-AM_26253039.wav,"Հազվադեպ է գործածվել, այնուհետև ընդհանրապես դուրս է եկել գործածությունից։"
common_voice_hy-AM_26253053.wav,Նրանք իրարից հիմնականում տարբերվում են չափսով։
common_voice_hy-AM_26253054.wav,Նրանց հարաբերությունները կարծես մտել են փակուղի։
common_voice_hy-AM_26253068.wav,Նախնական կրթությունը ստացել է գյուղի դպրոցում։
common_voice_hy-AM_26253069.wav,Այդ ելույթներից հետո ամբաստանյալները նրան դավաճան են հայտարարել։
common_voice_hy-AM_26253070.wav,Թողարկվել են հուշադրամներ թանկարժեք ու ոչ թանկարժեք մետաղներից։
common_voice_hy-AM_26253071.wav,Սկզբում հեղինակն այս գիրքը գրել էր իր երեխաների համար։
common_voice_hy-AM_26253072.wav,"Այն մատուցում են ոչ մեծ բաժակներով, հաճախ սուրճի հետ։"
common_voice_hy-AM_26253078.wav,Կոչվել է ներկայում գոյություն չունեցող գետակի անունով։
common_voice_hy-AM_26253079.wav,Դրան սկիզբ դրեց կաշվի գործարանի շինարարությունը։
common_voice_hy-AM_26253080.wav,Հինգ տարեկանում նա սկսել է դաշնամուր նվագել՝ ռադիոյով երաժշտություն լսելով։
common_voice_hy-AM_26253081.wav,Իրանի բնակչության մեծամասնությունը էթնիկ պարսիկներ են։
common_voice_hy-AM_26253082.wav,"Մայրն արգելում է նրան որևէ բան ստանալ փոստով բոլորից, բացի եղբորից։"
common_voice_hy-AM_26253089.wav,Բնադրում է ինքնուրույն փորված ծառաբներում։
common_voice_hy-AM_26253091.wav,Պարսամեան յաճախ եղած է արդարութեան եւ պոռթկումի ձայնը։
common_voice_hy-AM_26253092.wav,Տղան դուրս չի գալիս կոմայից և մահանում է։
common_voice_hy-AM_26253099.wav,Քաղաքին մէջ կայ նաւահանգիստ։
common_voice_hy-AM_26253100.wav,Բարիկադների վրա կռվում էին նաև կանայք ու երեխաներ։
common_voice_hy-AM_26253101.wav,Երկրորդ և երրորդ ցուցասրահներում հավաքված են քաղցրահամ ջրերի ձկներն ամբողջ աշխարհից։
common_voice_hy-AM_26253102.wav,"Եթե կապ կա, այն չպետք է կարել։"
common_voice_hy-AM_26253104.wav,Կան նաև այս պանրի սև և սպիտակ տեսակները։
common_voice_hy-AM_26253106.wav,Դիմադրության տարիներին երգել է ազատության համար մարտնչող ժողովրդին։
common_voice_hy-AM_26253108.wav,Այդ փողոցներին ուղղահայաց երեք փողոցներ լրացնում են քաղաքի ճանապարհային ցանցը։
common_voice_hy-AM_26253119.wav,Եվ շատ ուրիշներ։
common_voice_hy-AM_26253120.wav,Իրանում հայերի հաստատումը դարավոր պատմություն ունի։
common_voice_hy-AM_26253121.wav,"Շարթը բնության մարդկային բնավորությունների, ձևի ու լույսի վերարտադրման նուրբ վարպետ է։"
common_voice_hy-AM_26253122.wav,Դրանցից ամենահիշարժանները կենտրոնի հայկական քարե շենքերն են։
common_voice_hy-AM_26253123.wav,Ամառը սկսվում է մայիսից։
common_voice_hy-AM_26407610.wav,Համարվում է հնդկական կինոյի ամենահայտնի դերասաններից։
common_voice_hy-AM_26407611.wav,"Մշակում են բրինձ, արքայախնձոր, շաքարեղեգ, բանան։"
common_voice_hy-AM_26407612.wav,Մյուս երկու դահլիճները ավելի փոքր են։
common_voice_hy-AM_26407613.wav,"Սակայն, ոստիկանությունը մի օր, հենց ներկայացման ժամանակ, նրան ձերբակալում է թատրոնում։"
common_voice_hy-AM_26407614.wav,Խումբը բաղկացած է յոթ աղջիկներից։
common_voice_hy-AM_26407624.wav,Ուղղաթիռի հնացած անվանումն է հելիկոպտեր։
common_voice_hy-AM_26407625.wav,Իր գրած լիբրետոներից ոչ մեկը չներառվեց մյուզիքլի մեջ։
common_voice_hy-AM_26407626.wav,Իտալիայում երկար ժամանակ քննարկում էին նրա տրանսֆերային արժեքը։
common_voice_hy-AM_26407627.wav,Կախված ծանրության աստիճանից ինսուլինը կարող է ներմուծվել ներերակային կամ ենթամաշկային։
common_voice_hy-AM_26407628.wav,Բադնիքն ուներ հայկական եկեղեցի։
common_voice_hy-AM_26407635.wav,Մի քանի անգամ քաղաքի վրա հարձակվել են օդից։
common_voice_hy-AM_26407636.wav,Պտուղները թունավոր են։
common_voice_hy-AM_26407637.wav,Հատուկ դպրոցում խորը ուսումնասիրել է գերմաներեն լեզու։
common_voice_hy-AM_26407638.wav,"Կա կարծիք, որ ծածանի արծաթագույն թեփուկները նոր տարում փող են բերում։"
common_voice_hy-AM_26407645.wav,"Իրականում, սակայն, մրցակցությունը և հակակրանքը եղբայրների միջև չի դադարում։"
common_voice_hy-AM_26407646.wav,«Չեչնիայի սիրտ» մզկիթը աշխարհի ամենամեծ մզկիթներից մեկն է։
common_voice_hy-AM_26407648.wav,Ախտանշանների խորացումը հաճախ արագ է լինում։
common_voice_hy-AM_26423574.wav,Նա պահվել է կալանքի տակ։
common_voice_hy-AM_26423576.wav,"Երեք անգամ վիրավորվել է, ապաքինվելուց հետո վերադարձել մարտադաշտ։"
common_voice_hy-AM_26423577.wav,Կեանքին ընթացքին քանի մը անգամ բանտ կը նետուի։
common_voice_hy-AM_26423578.wav,Թեմայով և կատարմամբ այն նկարչի լավագույն գործերից է։
common_voice_hy-AM_26423628.wav,Զոյգը ողջախոհ փաթաթուած է իրար։
common_voice_hy-AM_26423630.wav,Ցամաքային ենթատեսակները կղզիաբնակներէն մեծ են։
common_voice_hy-AM_26423631.wav,Զբաղվել է նաև շինարարական գործունեությամբ։
common_voice_hy-AM_26423632.wav,"Գյուղի տարածքում գտնվում են հին գյուղատեղիներ, սրբատաշ քարերով եկեղեցի։"
common_voice_hy-AM_26423673.wav,Հետագա դարաշրջաններում ևս բազմիցս ենթարկվել են հարձակումների։
common_voice_hy-AM_26423674.wav,Քրիստոնեական եկեղեցիներում կենտրոնական աբսիդը կոչվում է ավագ խորան։
common_voice_hy-AM_26423675.wav,Միկասան կիսով չափ ասիացի է և իր ռասայի վերջին ներկայացուցիչն է։
common_voice_hy-AM_26423676.wav,Այն տոնում են տարվա առաջին ամսվա առաջին նորալուսնի օրը։
common_voice_hy-AM_26423778.wav,Մեր ֆիլմերի հերոսները փոփոխվում են ժամանակի ընթացքում։
common_voice_hy-AM_26423779.wav,Եվ մի անգամ նրանք գտնում են միմյանց։
common_voice_hy-AM_26423781.wav,Այս լճի հետ կապված են բազմաթիվ ավանդություններ ու ժողովրդական զրույցներ։
common_voice_hy-AM_26423782.wav,Հայտնի է իր չափազանց բարձր հրաբխային ակտիվությամբ և լավային լճերի ձևավորմամբ։
common_voice_hy-AM_26423818.wav,Զանջան նահանգը հայտնի է իր անկորիզ խաղողներով։
common_voice_hy-AM_26423819.wav,Դրա հետ նվազում է տառերը տեսնելու և ճանաչելու կարողությունը։
common_voice_hy-AM_26423820.wav,Ըստ պատրաստման ձևի լինում են կարով և անկար։
common_voice_hy-AM_26423843.wav,Նա չէր պատրաստվում զիջել ապստամբներին։
common_voice_hy-AM_26423844.wav,Շարունակությունն ընթացքի մեջ է։
common_voice_hy-AM_26423845.wav,Մարդկության պատմության նոր կամ նեոլիթ շրջանում նախամարդը արդեն բավականին զարգացել էր։
common_voice_hy-AM_26423846.wav,Մեծ մասամբ բաժանասեռ են։
common_voice_hy-AM_26423847.wav,Հատող փողոց չունի։
common_voice_hy-AM_26423870.wav,Այն օգտագործվում է լիվերի կողմից սկսած հին ժամանակներից։
common_voice_hy-AM_26423872.wav,"Մեղուները ակտիվանում են գարնանը, բնաորման հատկությունները հայտնի չեն։"
common_voice_hy-AM_26423892.wav,Շուտով ընտանիքում ծնվել է նաև տղա երեխա։
common_voice_hy-AM_26423893.wav,Ապա կը մասնակցի պատահական ներկայացումներու։
common_voice_hy-AM_26423894.wav,Սերժիպին ագրարային նահանգ է։
common_voice_hy-AM_26423895.wav,Նրանց ալբոմները և սինգլներն իրար հետևից հասնում էին մեծ հաջողությունների։
common_voice_hy-AM_26423896.wav,Միջփուլային լուսավոր շրջաններում հիվանդների աշխատունակությունը լրիվ պահպանվում է։
common_voice_hy-AM_26428861.wav,Ամասիոյ նահանգի վարչական կեդրոնն է։
common_voice_hy-AM_26428862.wav,Սուդանը նախագահական հանրապետություն է։
common_voice_hy-AM_26428863.wav,Նավի վրա խռովություն է բարձրանում։
common_voice_hy-AM_26428864.wav,Նույն թվականին հրատարակվել են նրա առաջին բանաստեղծությունները։
common_voice_hy-AM_26428865.wav,Երկու պատճառ կա անոթային փոփոխությունների զարգաման։
common_voice_hy-AM_26428898.wav,Ունի երկու հարկ՝ ծածկված աղյուսե թաղով և ամենավերին հարկը կամ տանիքը։
common_voice_hy-AM_26428900.wav,Այս գործերը շատ հեշտ են ընկալվում ոչ ճապոնացի հանդիսատեսի կողմից։
common_voice_hy-AM_26428902.wav,"Տիրապետում է ֆրանսերենին, գերմաներենին, ուրդուին և անգլերենին։"
common_voice_hy-AM_26428974.wav,Պայմանները բարենպաստ են ջերմասեր բույսերի և ծառատեսակների մշակման համար։
common_voice_hy-AM_26428975.wav,Ճակատները սվաղած չեն։
common_voice_hy-AM_26428976.wav,Վարակուողը պէտք չէ դպչի փամփշտիկներուն եւ պայթեցնէ զանոնք։
common_voice_hy-AM_26428978.wav,Կլավդիոսը ամուսնացած էր չորս անգամ։
common_voice_hy-AM_26428979.wav,Զոհվել է համառ դիմադրությունից հետո։
common_voice_hy-AM_26428980.wav,"Նստակյաց թռչուն է, որը բնադրում է հողի վրա։"
common_voice_hy-AM_26428981.wav,Անդրադարձել է բանահյուսական ու պատմական թեմաների։
common_voice_hy-AM_26428982.wav,Համլիրի նախնական տեսքը չի պահպանվել։
common_voice_hy-AM_26428983.wav,Թանգարանում տեղի են ունենում պարբերական ցուցահանդեսներ։
common_voice_hy-AM_26428984.wav,"Ստացվում է, որ բժիշկը գործում է միջնորդների միջոցով։"
common_voice_hy-AM_26428985.wav,"Յառաջացած արմատներ չեն ունենար, արմատները միայն կ՚ապահովեն բնակարանին վրայ կառչումը։"
common_voice_hy-AM_26428986.wav,"Արագիլի ձագերը լսելով երգը, վախենում են և սկսում ճվճվալ։"
common_voice_hy-AM_26428988.wav,Բազմանիստերի համար նման պնդումը ճիշտ չէ։
common_voice_hy-AM_26428990.wav,"Տերևները հերթադիր են, եռաբլթակ։"
common_voice_hy-AM_26428991.wav,"Դէմքը պարզ էր, կարծես ոչ մի նօթ չարտայայտող։"
common_voice_hy-AM_26428993.wav,Առիթմիաների շատ տիպեր ընթանում են անախտանիշ։
common_voice_hy-AM_26428995.wav,Պլուտոնին զոհաբերում էին խոշոր եղջերավոր անասուններ։
common_voice_hy-AM_26428996.wav,Օրը նուիրուած է պաիր բոլոր ոճերուն։
common_voice_hy-AM_26428997.wav,Զբաղած է հայկական զօրաբանակի կազմաւորումով։
common_voice_hy-AM_26428998.wav,Նա իր հետ վերցրել է խոզի տեսքով երաժշտական արկղ։
common_voice_hy-AM_26634250.wav,Մեկական անգամ նվաճել է ֆուտբոլի և լիգայի գավաթները։
common_voice_hy-AM_26634251.wav,Աշխատում է չափվող տատանման պարբերությունների թվի հաշվման սկզբունքով։
common_voice_hy-AM_26634252.wav,Նրանք ունեին ցածր կարողություն և թուլացած շարժիչներ։
common_voice_hy-AM_26634253.wav,Սկայորդի իշխանի որդին։
common_voice_hy-AM_26634254.wav,Նա նաև թողարկել էր սինգլերի շապիկներըը։
common_voice_hy-AM_26782935.wav,Նավի վրա բացակայում են բժիշկը և կուպերը (տակառագործ)։
common_voice_hy-AM_26782936.wav,Ուսման վարձը վճարելու համար նա մատուցող է աշխատել։
common_voice_hy-AM_26782938.wav,Հին ժամանակներում այս տեղը զբաղեցնում էր կարևոր ռազմավարական դիրք։
common_voice_hy-AM_26783025.wav,Ավարտել է ռազմական ուսումնարանը ստանալով ենթասպայի աստիճան։
common_voice_hy-AM_26783026.wav,Նա երկու երեխա է մեծացնում։
common_voice_hy-AM_26783028.wav,"Հայրը ուներ գերմանական արմատներ, մայրը՝ նորվեգական։"
common_voice_hy-AM_26783029.wav,Ազոտային պարարտանյութերը հիմնականում ստանում են սինթետիկ ամոնիակից։
common_voice_hy-AM_26783115.wav,Գիրքը լայն արձագանք է գտել և բազմիցս քննադատվել։
common_voice_hy-AM_26783116.wav,Տոմսի գները կախված է մրցաշարի փուլից։
common_voice_hy-AM_26783117.wav,"Շենքն ունի հարկերի մեջ գտնվող քիվեր, կիսաշրջանաձև պատուհաններ։"
common_voice_hy-AM_26783118.wav,Բնակչության զբաղվածության կառուցվածքը։
