path,sentence
common_voice_hy-AM_39296349.wav,Ամեն կողմից դարձյալ ինձ հաջողություն էին խոստանում…
common_voice_hy-AM_39296365.wav,Առավոտյան սովորականից վաղ վեր կացավ և թարգմանությունը շարունակեց:
common_voice_hy-AM_39296366.wav,Տասն էր չէ՞:
common_voice_hy-AM_39296367.wav,"- Իսկ նրանց աղջի՞կը,- չկարողացա դիմանալ և հարցրի ես:"
common_voice_hy-AM_39296368.wav,Հունաստանում բնակչության թվաքանակով համարվում է յոթերորդը։
common_voice_hy-AM_39296416.wav,Իր դրության մասին նրա գլխում ծնվող թեր և դեմ մտածմունքները մի կատարյալ քաոս էին ներկայացնում:
common_voice_hy-AM_39296417.wav,"Գլուխս այնքան ծանր էր, որ կարծես գանգս դատարկել և լցրել էին կապարով:"
common_voice_hy-AM_39296418.wav,"Լոնմարկետը նախկինում շուկա էր, որտեղ զբաղվում էին կտորի առևտրով։"
common_voice_hy-AM_39296419.wav,"- Բավական չեղա՞վ, որքան այս գարշելի կիրքը կուրացրեց ինձ…"
common_voice_hy-AM_39296420.wav,"Մյուսը միջին տարիքի կին էր, իսկ երրորդը՝ շատ ջահել, թխադեմ, ժպտուն, կրակոտ աչքերով:"
common_voice_hy-AM_39296550.wav,Կոնսերվատիվ բուժման արդյունքներն ավելի դրական են նվազ արտահայտված դեֆորմացիաների դեպքում։
common_voice_hy-AM_39296551.wav,Երբեմն որսի էինք գնում:
common_voice_hy-AM_39296552.wav,Իմ և ինձ շրջապատող մարդկանց միջև ոչ մի առնչություն չէի տեսնում:
common_voice_hy-AM_39296553.wav,Կոթողիկէ եկեղեցին այս անունով տօն չունի։
common_voice_hy-AM_39296554.wav,Այն բաղկացած է երեք երաժշտական թեմայից։
common_voice_hy-AM_39296906.wav,"Մանեն նայեց նրան առաջվա պես հանգիստ, բայց այս անգամ խիստ տխրալի հայացքով:"
common_voice_hy-AM_39296907.wav,"Նա հայտնի է իր տաք աղբյուրներով, որոնք հարուստ են ռադոնով։"
common_voice_hy-AM_39296908.wav,Վաճառքից ստացված մի որոշ հատված տրամադրվում էր բարեգործական նպատակների համար։
common_voice_hy-AM_39296909.wav,"Իսկ ես կարո՞ղ եմ առանց իմ երեխաների գեթ մի օր, մի ժամ ապրել:"
common_voice_hy-AM_39296910.wav,"Ստեղծագործությունը հետագայում հրատարակել է, որպես առանձին քառյակ։"
common_voice_hy-AM_39307022.wav,Հայերը իրենց գործունեությամբ կարևոր դեր էին խաղում հասարակական քաղաքական կյանքում։
common_voice_hy-AM_39307023.wav,Բավականին լռակյաց թռչուն է։
common_voice_hy-AM_39307024.wav,"Նա բազմալեզու է, բուժելու ունակություններ ունի և կարողե գուշակել ապագան։"
common_voice_hy-AM_39307025.wav,"Թաղման օրը քիչ էր մնում, որ մայրս փակի ինձ տանը:"
common_voice_hy-AM_39307026.wav,Նրա բանաստեղծությունները և թարգմանությունները տպագրվել են հանրապետական գրական մամուլում։
common_voice_hy-AM_39307042.wav,"Բույսն աճում է բարձրադիր մասերում, որոշ տեսակներ՝ նաև գետերի ափերին։"
common_voice_hy-AM_39307043.wav,"- Եվ այլն, և այլն,- կանչեց ծիծաղելով Բարսեղը:"
common_voice_hy-AM_39307044.wav,"Եվ այդ նրանց համար երկնային երջանկություն էր, որին ուրիշ մի բանի հետ փոխել չէին կարող:"
common_voice_hy-AM_39307045.wav,- Ես չեմ ուզում ձեզ լսել:
common_voice_hy-AM_39307080.wav,Բնադրում է գաղութներով։
common_voice_hy-AM_39307081.wav,"Դիլան դային չոքեց, նշան բռնեց:"
common_voice_hy-AM_39307082.wav,"Կամրջով իրականացվում են ավտոմոբիլային, հեծանվային, հետիոտնային և երկաթուղային փոխադրումներ։"
common_voice_hy-AM_39307083.wav,"Տիրապետում է կիթառի, դաշնամուրի, որոնց տիրապետել սովորել է ինքնուրույն։"
common_voice_hy-AM_39307084.wav,Կարճ խոսքերով պատմեմ իրողությունը:
common_voice_hy-AM_39307115.wav,Նա երգեց այն իրար հետևից յոթ անգամ։
common_voice_hy-AM_39307116.wav,"Ոչ տուն ուներ, ոչ մի որևիցե միջոց."
common_voice_hy-AM_39307117.wav,Արհեստական կաուչուկի հայտնվելուց հետո քաղաքի տնտեսության աճը զգալիորեն դանդաղել է։
common_voice_hy-AM_39307118.wav,"Յուրաքանչյուր դափնեկրի հանձնվում է շքանշան, դիպլոմ և դրամական պարգև։"
common_voice_hy-AM_39307119.wav,"- Ինչո՞ւ պիտի գողանայի, պապա:"
common_voice_hy-AM_39307140.wav,"Բայց քեզ հետ այսուհետև շատ խիստ կվարվեմ, որպեսզի ինձ հարգես:"
common_voice_hy-AM_39307141.wav,Տարածված են սարավանդներում։
common_voice_hy-AM_39307143.wav,Աննան չկարողացավ չծիծաղել:
common_voice_hy-AM_39307144.wav,Խուլուի բնակչությունը գնալով նվազում է։
common_voice_hy-AM_39307196.wav,"Ալենը երեք տարեկան էլ չկար, երբ ծնողներն ամուսնալուծվեցին։"
common_voice_hy-AM_39307197.wav,Գերմանիայի կառավարությունը և հանրությունը հասկանում են այդ իրադարձությունների պատասխանատվության մասշտաբը։
common_voice_hy-AM_39307199.wav,Մինչդեռ գաղափարագիրն արտահայտում էր բառի մաստ (հասկացություն)։
common_voice_hy-AM_39307200.wav,Հանկարծ մի թփի հետևից լսվեց կաքավի ձայնը.
common_voice_hy-AM_39307235.wav,Նա վիրավորվում է ոտքից։
common_voice_hy-AM_39307236.wav,Ներկայումս այն զարդարում է քաղաքի քաղաքապետարանի նիստերի դահլիճը։
common_voice_hy-AM_39307237.wav,Սակայն համաշխարհային էլիտան այդ տեխնոլոգիաները խնամքով պահվում են երկրի բնակչությունից։
common_voice_hy-AM_39307238.wav,- Իսկ այժմ գնամ տեսնեմ ինչ արին մեր նոր վարժուհու իրեղենները:
common_voice_hy-AM_39307239.wav,Էմինյոնյուն յուրացրել են դեռևս անհիշելի ժամանակներից։
common_voice_hy-AM_39315593.wav,Փորձաշրջանը լավ անցնելով նա տեղ է գտնում թիմի հիմնական կազմում։
common_voice_hy-AM_39315594.wav,Երեխան տմբտմբացրեց գլուխը և աչքերը չորս շինած հառեց թասի ջրին:
common_voice_hy-AM_39315595.wav,Սուկրեի նահանգի մայրաքաղաքը և խոշորագույն քաղաքը։
common_voice_hy-AM_39315596.wav,"Սակայն նա եզրակացնում է, որ աղջիկը կարող է տուն վերադառնալ։"
common_voice_hy-AM_39315597.wav,Անվան և աղբյուրի առաջացման մասին կա ավանդույթ։
common_voice_hy-AM_39315598.wav,Սովորաբար մրցանակի հետ տրվում էր նաև շքանշան։
common_voice_hy-AM_39315599.wav,Բաս չանիծե՞մ նրան այդպես գժվեցնողին:
common_voice_hy-AM_39315600.wav,Ես ի՛նչ գիտեի…
common_voice_hy-AM_39315601.wav,Գետի այս հատուածը բնութեան իւրօրինակ վայրերէն մէկն է։
common_voice_hy-AM_39315602.wav,"Նա հասկացել է, որ չի կարող խառնել բոլոր երգերը միասին։"
common_voice_hy-AM_39315608.wav,- Եղբայրդ ի՞նչ գործ ունի այստեղ:
common_voice_hy-AM_39315609.wav,"Բլեք մետալ ոճի դասական ալբոմ է, սակայն էպիկական տարրերով։"
common_voice_hy-AM_39315610.wav,Պատերի վերին մասում տեղադրվել են կառույցը լուսավորող պատուհանները։
common_voice_hy-AM_39315611.wav,"- Ի՞նչ լավ է, որ եկել ես."
common_voice_hy-AM_39315612.wav,Եվայի պատմության ամբողջ ընթացքում խոսք չէր գտնում ասելու - այնքան այդ պատմությունը նորություն էր նրա համար:
common_voice_hy-AM_39315618.wav,Շրջանի տարածքը հիմնականում օգտագործվում էր ռանչոյի համար։
common_voice_hy-AM_39315619.wav,Այն իրենից ներկայացնում է չափածո վեպ։
common_voice_hy-AM_39315621.wav,"Նրանցից ամեն մեկը ջանք են թափում, որպեսզի լինեն երջանիկ։"
common_voice_hy-AM_39315622.wav,"Դրանով, ծայրաստիճան անհրաժեշտությունից բացի, կենդանիներին չեն սպանում։"
common_voice_hy-AM_39315623.wav,Բջիջային եւ անլար հեռախօսակապերը առկայ են։
common_voice_hy-AM_39315624.wav,Այս երկու իրադարձությունների շնորհիվ ծնվեց գաղափար ստեղծել փառատոն նվիրված երեխաներին։
common_voice_hy-AM_39315625.wav,Արտաքին տեսքով սա սովորական խլուրդ է։
common_voice_hy-AM_39315626.wav,Նրա ծնողները երկուսն էլ աշխատել են գործարանում։
common_voice_hy-AM_39315633.wav,Բնակչությունը զբաղվում է անասնապահությամբ և հողագործությամբ։
common_voice_hy-AM_39315634.wav,"Ես էլ վերարկուս չեմ հանում, որովհետև սարսափելի ցուրտ է այստեղ:"
common_voice_hy-AM_39315635.wav,"- Ոչ, չենք գնում:"
common_voice_hy-AM_39315636.wav,Շիրազը հայտնի էր իր լավ հումորի զգացումով։
common_voice_hy-AM_39315637.wav,Վացլավը նրանց ավագ որդին էր։
common_voice_hy-AM_39315653.wav,Ֆիլմը ցածր գնահատականների է արժանացել կինոքննադատների կողմից։
common_voice_hy-AM_39315654.wav,"Նա վերցնում է ներկերը, իսկ հետո ինքն է փորձում նկարել դրանցով։"
common_voice_hy-AM_39315655.wav,"ապա ամեն մարդ հիվանդ է և ամեն մարդ, և ամբողջ մարդկությունը պետք է բժշկվի:"
common_voice_hy-AM_39315656.wav,- Գնա տեղաշորս գցի:
common_voice_hy-AM_39315657.wav,Դևիդ Վոնը ամուսնացած է։
common_voice_hy-AM_39315664.wav,Ռապսոդիաները իրենց մասշտաբովբազմատեսակ են։
common_voice_hy-AM_39315665.wav,Մորթին շագանակագույն է։
common_voice_hy-AM_39315666.wav,Աննան արագ նայեց Զազունյանին:
common_voice_hy-AM_39315667.wav,այդ կարող է ձեզ վնասել:
common_voice_hy-AM_39315673.wav,Աշխատել է պետական պլանավորման կազմակերպությունում։
common_voice_hy-AM_39315674.wav,"Երկար ժամանակ դա եղել է գլխավոր զոհասենյակում, հետագայում տեղափոխվել է կրիպտոն։"
common_voice_hy-AM_39315675.wav,Այս ասելս ու նրա տեղից վեր թռչելը մեկ եղավ:
common_voice_hy-AM_39315677.wav,Մանկուց սիրել է կրեոլական երաժշտություն։
common_voice_hy-AM_39315688.wav,"Երկինքը բարձր էր, շատ բարձր և իր բարձրությունից նայում էր ներքև բաց-փիրուզի անփայլ կապույտով:"
common_voice_hy-AM_39315689.wav,"- Լավ, որ այդպես է,- ասաց նա,- էլ ինչո՞ւ եք ձեզ այդքան տանջում:"
common_voice_hy-AM_39315690.wav,"Եթերացանկը կազմված է տեղեկատվական հաղորդումներից, հեռարձակվում է տաջիկերեն լեզվով։"
common_voice_hy-AM_39315691.wav,Մարությանն արագ դարձավ դեպի Բազենյանի մահճակալը:
common_voice_hy-AM_39315692.wav,Դրամավարկային քաղաքականության միջանկյալ նպատակը պետք է բավարարի չափելի լինելու հատկանիշին։
common_voice_hy-AM_39327234.wav,"Փախստականները փորձել են հավաքել ջրի, պարենամթերքի ու բենզինի պաշար։"
common_voice_hy-AM_39327235.wav,"Այդ տարիներից հետաքրքրվել է թատրոնով, փոքր դերեր է ստացել հայերեն ներկայացումներում։"
common_voice_hy-AM_39327236.wav,"Սկզբում այն հնչեցնում էին հրամանում, իսկ այնուհետև սկսեցին շնորհել պարգևատրման նամակ։"
common_voice_hy-AM_39327237.wav,Շրջակայքի նկատմամբ բարձրությունը չնչին է։
common_voice_hy-AM_39327238.wav,Այդ ժամանակվանից նա հայտնի դարձավ իր հանդիսատեսին անձնական վերաբերմունք ցույց տալով։
common_voice_hy-AM_39327283.wav,Փայտյա բրիկետերի համար փայտի տեսակը էական չէ.։
common_voice_hy-AM_39327284.wav,Բոժինովի հիմնական առարկան դարձել է երկրի պաշտպանությունը։
common_voice_hy-AM_39327285.wav,Նրա համարձակ և նորարարական գաղափարները յուրահատուկ սինթեզ ստեղծեցին գոթական ճարտարապետության մեջ։
common_voice_hy-AM_39327286.wav,Նրա նախնիները կազակական գնդերի հայտնի գնդապետներ էին։
common_voice_hy-AM_39327819.wav,Աղա Գրիգոր Մոսեիչին ես մի մազաչափ անգամ չեմ խղճալու…
common_voice_hy-AM_39327820.wav,"Այն միակ նավն էր տարածաշրջանում, որը եկավ օգնության։"
common_voice_hy-AM_39327821.wav,Մասնակցել է բազմաթիվ թատերական ներկայացումների և հեռուստատեսային հաղորդումների։
common_voice_hy-AM_39327823.wav,"Զաքարը տանը չէր, ինչպես և նախորդ օրը:"
common_voice_hy-AM_39327825.wav,Մատվեևը մեռած է հայտարարվում։
common_voice_hy-AM_39373209.wav,"Ասենք, այսպիսի եղանակ չէ:"
common_voice_hy-AM_39373211.wav,Ռոստովի մարզի քաղաքներում բազմաթիվ արձանների հեղինակ։
common_voice_hy-AM_39373212.wav,"Սայլակին ուղեկցում է շունը, որը վազում է երեխաների աջ կողմում։"
common_voice_hy-AM_39373214.wav,Այս դերի համար նա լիովին սափրում է գլուխը։
common_voice_hy-AM_39373452.wav,Նա ունի շատ սուր տեսողություն և լսողություն։
common_voice_hy-AM_39373453.wav,Սա ցույց է տալիս բառի իմաստը՝ ըստ լեզվակիր գրողների։
common_voice_hy-AM_39373454.wav,"Ախր, որ գիտենաս ինչ է կատարվում իմ մեջ…"
common_voice_hy-AM_39373455.wav,Աստիճանաբար սաստկացել է սրտի հիվանդությունը։
common_voice_hy-AM_39373456.wav,Չաթալ օսկոր կայ քու սրտի մէջ ու չորս պլոճիկ։
common_voice_hy-AM_39373501.wav,Զբաղվել է հայ ժողովրդի ծագման խնդրով։
common_voice_hy-AM_39373503.wav,Երկու ստեղծագործություններն էլ հանդիսատեսի դատին են հանձնվել տեսահոլովակներով։
common_voice_hy-AM_39373505.wav,"Դժվար չէ նկատել, որ ժամանակային առումով այն համընկնում է ժողովրդագրական պայթյունին։"
common_voice_hy-AM_39373507.wav,"Այդ մահ է, ավելի վատ, քան մահը:"
common_voice_hy-AM_39373508.wav,Վարակի հիմնական աղբյուրը հիվանդ և հիվանդությունից առողջացած կենդանիներն են։
common_voice_hy-AM_39436255.wav,Տեսավ էրկու կտոր շաքար պակաս ա.
common_voice_hy-AM_39436256.wav,"Նա վեր կացավ և, ձեռքերն անդրավարտիքի գրպանները կոխելով, սկսեց անցուդարձ անել սենյակի երկայնքով:"
common_voice_hy-AM_39436257.wav,Չլինի՞ կարծում եք կվախենամ ձեզնից:
common_voice_hy-AM_39436258.wav,"Սպորանգիումները կլորավուն են, երկշարք դասավորված, հասունանալուց բացվում են լայնակի ճեղքերով։"
common_voice_hy-AM_39436354.wav,"Մյուսների պես նա մոտեցավ ձեռք տալու, տրեխի ծայրերն իրար դիպան, քիչ մնաց ընկներ:"
common_voice_hy-AM_39436355.wav,"- Մի՞թե կարծում եք, օր ես քվիթ լինելու համար…"
common_voice_hy-AM_39436356.wav,Ֆլորիանին բնորոշ է դեպի առօրյա կյանքն ունեցած հետաքրքրությունը։
common_voice_hy-AM_39436358.wav,"Պտղամիսը սպիտակ է, կտրվածքում՝ վարդագույն, հաճելի սնկային համով և բույրով։"
common_voice_hy-AM_39436463.wav,"Այն դասվեց բժշկության պատմության մեջ առաջին զեկուցված, վերահսկվող, կլինիկական փորձերի շարքին։"
common_voice_hy-AM_39436465.wav,"Ռիսկերի պլաստիկում քառակուսին գերակշռում է, հիերոգլիֆները մոնումենտալ և ամուր են։"
common_voice_hy-AM_39436467.wav,Պատերազմի սկզբնական շրջանը բաժանվում է երկու փուլերի։
common_voice_hy-AM_39470304.wav,Տան ճակատային մասը գտնվում է վթարային վիճակում։
common_voice_hy-AM_39470306.wav,"Նրա բանաստեղծությունները թարգմանվել են բազմաթիվ լեզուներով, ներառյալ ռուսերեն։"
common_voice_hy-AM_39470308.wav,Ներքևում ներկայացված են մասնակից հայտնի ընկերությունների ցանկը։
common_voice_hy-AM_39470310.wav,Պատմվածաշարը հեղինակը նվիրել է կնոջը։
common_voice_hy-AM_39470383.wav,Նրան պետք էր ստանալ կրկնակի ամուսնություն կնքելու համար անհրաժեշտ փաստաթուղթ։
common_voice_hy-AM_39470385.wav,Այգում կկա հյուրանոց և տուրիստական տարբեր կառույցներ և տեսարժանություններ։
common_voice_hy-AM_39470386.wav,Նա բոլորովին զարմացած մնացել էր նրա այդ օտարոտի բնավորության վերա:
common_voice_hy-AM_39470475.wav,Սակայն նրանք դրանից հետո էլ պահպանել են բարեկամական հարաբերությունները։
common_voice_hy-AM_39470477.wav,Չի ընդունել և բազմիցս քննադատել է սոցռեալիզմի արվեստը։
common_voice_hy-AM_39470482.wav,Աղիութեան պատճառով կենդանական աշխարհը գրեթէ կը բացակայի։
common_voice_hy-AM_39470485.wav,Հորմոնը հայտնաբերվել է նաև ուղեղում ու վեգետատիվ նյարդային համակարգի որոշ նեյրոններում։
common_voice_hy-AM_39470616.wav,Վայրեջքը կատարվում է հուշարձանի ներսում գտնվող աստիճաններով։
common_voice_hy-AM_39470618.wav,"Դաշնության կառավարման մեխանիզմը կոչվում է դաշնային, որը ֆեդերալիզմի օրինակ է համարվում։"
common_voice_hy-AM_39470620.wav,Կարբոնահիգրազ հայտնաբերված է նաև առանձին բույսերի տերևներում։
common_voice_hy-AM_39470622.wav,Դեկանները պարունակվում են բենզինային ֆրակցիաներում։
common_voice_hy-AM_39470624.wav,Բնակչության մեծ մասը կազմում են արմատական ֆիջիացիները և ֆիջիացի հնդկացիները։
common_voice_hy-AM_39470704.wav,Այդ ժամանակաշրջանին են վերաբերում թղթի վրա լուսանկարչական պատկերների առաջին տպագրությունները։
common_voice_hy-AM_39470705.wav,Եասուտա ինքնաշխատութեամբ կը սորվի ֆիլմի կերպար գծելու ձեւերը։
common_voice_hy-AM_39470710.wav,Թատրոնի խաղացանկը հիմնականում բաղկացած էր հեղափոխական սովետական և արտասահմանյան դրամատուրգիայից։
common_voice_hy-AM_39470712.wav,"Տերևները՝ հաստակեղև, բուրավետ, ծաղիկները՝ մանր, սպիտակավուն։"
common_voice_hy-AM_39470853.wav,Այն իր մեջ ներառում է նաև պահեստատուփի ինդիկատոր։
common_voice_hy-AM_39470855.wav,Ինուիտերենը պոլիսինթեթիկ լեզու է։
common_voice_hy-AM_39470857.wav,"Լեզուն կարճ է, մկանոտ։"
common_voice_hy-AM_39470859.wav,Նա սերում է թագավորական դինաստիայից։
common_voice_hy-AM_39470861.wav,"Այս հուշարձանները գտնվում են հինավուրց մեդինայից դուրս, շրջապատված պատով։"
common_voice_hy-AM_39471072.wav,Կյանքի վերջին տարիներին ծանր հիվանդ է եղել։
common_voice_hy-AM_39471073.wav,"Նրանց բերում են արքայական պալատ, իսկ թագավորը երկու հարսանիք է կազմակերպում։"
common_voice_hy-AM_39471075.wav,Հավակնորդին մյուս փուլ անցկացնելու համար նրանք քվեարկում են մասնակցին՝ սևեռակը սեղմելով։
common_voice_hy-AM_39471198.wav,Կազմված է պալեոգենի լավաներից ու պեռլիտներից։
common_voice_hy-AM_39471200.wav,Գյուղատնտեսության ու արհեստագործության մեջ շարունակում էին օգտագործել ստրկական ուժը։
common_voice_hy-AM_39471202.wav,Մարտից մեկ շաբաթ առաջ ռազմական ուժերի կուտակում և սկսվեց գրոհի նախապատրաստությունները։
common_voice_hy-AM_39471203.wav,Սպառողի վարքագծի ուսումնասիրության նպատակն է որոշել նրա գործողությունների կանխատեսելիությունը։
common_voice_hy-AM_39471378.wav,Պաշարման ընթացքում մի քանի անգլիական նավեր կարողանում են ճեղքել պաշարումը։
common_voice_hy-AM_39471380.wav,Նրա հայրը կորցրել է իր հավատքը և ինքնասպան եղել։
common_voice_hy-AM_39471413.wav,Այս կրճատված պիեսները հատուկ անուն ստացան՝ հաննո («կիսանո»)։
common_voice_hy-AM_39471415.wav,Աղջիկները վախենում են։
common_voice_hy-AM_39471423.wav,Աշխատանքից հետո հաճախում էր դրամատիկական խմբակ։
common_voice_hy-AM_39471429.wav,Նույն թվականին զորակոչվում է բանակ։
common_voice_hy-AM_39471446.wav,"Ինչ-որ սև բան, մշուշի պես, եկավ ծածկեց նրա աչքերի առաջը:"
common_voice_hy-AM_39471449.wav,"- Մայրի՜կ, դու այսօր է՞լ ես լալիս:"
common_voice_hy-AM_39471451.wav,Երկրի ամենաբարձր կետը մակնշված է փոքրիկ հուշարձանով։
common_voice_hy-AM_39471476.wav,Ապացուցել է կենդանի ձևերի էվոլյուցիայի պատճառական կախվածությունը միջավայրի պայմանների փոփոխությունից։
common_voice_hy-AM_39471477.wav,"- Այ, ինչպես պատահեց:"
common_voice_hy-AM_39471478.wav,Նաքսոսը մյուս կղզիներից առանձնանում է պաշարման ընթացքում ցուցաբերած յուրահատուկ դիմադրության շնորհիվ։
common_voice_hy-AM_39471479.wav,"Մեջքի վրա ունեն խաչի նման պատկեր, որտեղից էլ առաջացել է անվանումը։"
common_voice_hy-AM_39471961.wav,"Հարմարված են չոր և շոգ կլիմային, պահանջկոտ չեն։"
common_voice_hy-AM_39471965.wav,"Նույն տարում, հուլիս ամսին մահանում է նրա մայրը։"
common_voice_hy-AM_39472085.wav,Հիմնականում բնակիչները զբաղվում են անասնապահությամբ և հողագործությամբ։
