path,sentence
common_voice_hy-AM_39472721.wav,Համապատասխանում է բույսերի ցեղ կատեգորիային։
common_voice_hy-AM_39472722.wav,"Վայրի խաղողն օգտագործվում է շենքերի ճակատների, պատշգամբների, լոջիաների դեկորատիվ ձևավորման համար։"
common_voice_hy-AM_39472723.wav,Դպրոցի շենքը հենվում է տաճարի պատին։
common_voice_hy-AM_39472724.wav,Պահպանելով պատմվածքի սյուժետային գիծը՝ հեղինակները գիտակցաբար գործողությունը տեղափոխել են մեր օրերը։
common_voice_hy-AM_39472725.wav,Քաղաքում գործում է նույնանուն ֆուտբոլային ակումբ։
common_voice_hy-AM_39473531.wav,Տիրապետում է թուրքերենին և անգլերենին։
common_voice_hy-AM_39473534.wav,"Մեզ են հասել թղթեր, գրություններ և իր ինքնակենսագրությունը։"
common_voice_hy-AM_39473538.wav,"Արտահայտել է խոշոր բուրժուազիայի շահերը, խոչընդոտել է սոցիալական ռեֆորմների անցկացմանը։"
common_voice_hy-AM_39473540.wav,Հարավային մուտքն ունի շեշտված պայտաձև լյունետ։
common_voice_hy-AM_39473565.wav,"Հայկական տարանուններն են՝ կցմծուկ, սամնտրուկ, սանտրուկ, սնդրիկ, սնդրուկ, քրմնցուկ։"
common_voice_hy-AM_39473566.wav,Սակայն միաբանության ներսում դժգոհություն էր հասունանում։
common_voice_hy-AM_39473567.wav,"Փայտե բարձր հարմարանք դահլիճում կամ լսարանում, որտեղից կարդացվում են դասախոսություններ, զեկուցումներ։"
common_voice_hy-AM_39473568.wav,Տեղանքի կլիման ցուրտ է։
common_voice_hy-AM_39473569.wav,"Նա կյանքն անտանելի թշվառություն էր համարում, բայց ինքը փառավորապես օգտվեց այդ կյանքից ամբողջ յոթանասուն տարի:"
common_voice_hy-AM_39473590.wav,"Մենք հարցրեցինք, թե արդյոք նրանք ցանկանում են ստուգել մեր ինքնությունը։"
common_voice_hy-AM_39473591.wav,Ստորև բերված է բաժինների և հավելվածների ցանկը թեմաներով։
common_voice_hy-AM_39473592.wav,"Նկարել է ժանրային նկարներ, բնանկարներ, դիմանկարներ, նատյուրմորտներ։"
common_voice_hy-AM_39473593.wav,"Պնդում են, որ այդ ապուրը ամրապնդում է առնականությունը։"
common_voice_hy-AM_39473594.wav,Նա մանկուց է ցուցաբերել նկարչության ոլորտում ունակություններ։
common_voice_hy-AM_39473620.wav,"Բանն այն էր, որ քաղաքի մոտ առողջարար գետ էր հոսում։"
common_voice_hy-AM_39473621.wav,Բրյուսը համաձայնվում է և նա դառնում է ամենակարող։
common_voice_hy-AM_39473622.wav,"Վարել է արկածներով, ռազմական բախումներվ ու սիրային արկածներով։"
common_voice_hy-AM_39473623.wav,Դիվանագիտական աստիճանները շնորհվում են ցմահ։
common_voice_hy-AM_39473624.wav,Կը թալանուին այնտեղ եղած արժէքաւոր պատմական իրերը։
common_voice_hy-AM_39473730.wav,"Ռեֆլեքսային սինկոպեն բաժանված է երեք տեսակի՝ վազովագալ, իրավիճակային և կարոտիդային սինուս։"
common_voice_hy-AM_39473731.wav,"Ցուցանմուշների մեջ են նկարներ, քանդակներ, կտավներ և այլն։"
common_voice_hy-AM_39473733.wav,Գտնվել և ձերբակալվել է հենց նույն օրը։
common_voice_hy-AM_39473735.wav,Նրա տեմբրը քնարական տենոր էր։
common_voice_hy-AM_39473737.wav,Տեսահոլովակը դրական ընդունելության է արժանացել երաժշտական քննադատների կողմից։
common_voice_hy-AM_39473782.wav,"Մայրը մաթեմատիկայի ուսուցչուհի է, հայրը՝ ռուսաց լեզվի ու գրականության, պատմության։"
common_voice_hy-AM_39473784.wav,Հռոմեական դարաշրջանում դպրոցը կենտրոնանում էր նրա աշխատանքը պահպանելու և պաշտպանելու վրա։
common_voice_hy-AM_39473786.wav,Այն կարևոր արդյունաբերական և քաղաքական կենտրոն է։
common_voice_hy-AM_39473787.wav,Կղզին ունեցել է ծովային հարուստ ավանդույթներ։
common_voice_hy-AM_39473788.wav,Ուզում ես՝ հենց այս երեկո:
common_voice_hy-AM_39473800.wav,- Բայց ինչո՞ւ մինչև հիմա պառկած ես:
common_voice_hy-AM_39473801.wav,Սիամանթոն հայ պոեզիայի ամենաինքնատիպ դեմքերից է։
common_voice_hy-AM_39473803.wav,Ըստ մանկավարժի՝ երեխաներին ավելի շատ հետաքրքում է իրերի ու երևույթների էվոլյուցիան։
common_voice_hy-AM_39473805.wav,Թևս է միայն վնասվել.
common_voice_hy-AM_39473807.wav,"Եղել է լաբորանտ, ասիստենտ։"
common_voice_hy-AM_39473920.wav,Նրանք ծանոթանում են։
common_voice_hy-AM_39473921.wav,Նրա աշխատանքների հիման վրա սկիզբ է առել նոր ուղղություն՝ փորձարարական հնչյունաբանությունը։
common_voice_hy-AM_39473923.wav,Առաջարկվում է նաև էլեկտրոնային ռեսուրսների հասանելիություն։
common_voice_hy-AM_39473925.wav,Նրանց ընտանիքում եղել է ինը երեխա։
common_voice_hy-AM_39473942.wav,Մոդելների դերերում հանդես են եկել մարմնամարզիկներ։
common_voice_hy-AM_39473943.wav,Սոցիալական պարերի ժամանակ հաճախ կատարվում է զույգերի փոխանակում։
common_voice_hy-AM_39473944.wav,Ուղիղ ժամի մեկին ես կվերադառնամ:
common_voice_hy-AM_39473945.wav,Նման բնույթի են ոսկերչական զարդարանքների արձանիկներն ու հարթաքանդակները։
common_voice_hy-AM_39473946.wav,"Զիադեն հայտնի է եղել արաբական գրական շրջանակներում, որտեղ կային բազմաթիվ գրողներ։"
common_voice_hy-AM_39473957.wav,Կիրճերում աճում են թփուտներ։
common_voice_hy-AM_39473958.wav,"Համապատասխանաբար, բացված տուփերն անհրաժեշտ է արագ օգտագործել։"
common_voice_hy-AM_39473959.wav,"Տանիքը հարթ է, դեպի գլխավոր մուտք տանում է լայն սանդուղքը։"
common_voice_hy-AM_39473960.wav,Միևնույն ժամանակ կոլեկտիվը սկսել էր քայլել դեպի իր փլուզում։
common_voice_hy-AM_39473961.wav,Օրինակ՝ բիսեքսուալ նույնականացվող անձը կարող է ունենալ նախասիրություն սեռերից մեկի հանդեպ։
common_voice_hy-AM_39473996.wav,Յուրաքանչյուր մրցաշրջանի ավարտին առավելագույն միավորներ հավաքած ակումբը ստանում է չեմպիոնական տիտղոս։
common_voice_hy-AM_39473997.wav,Այնուհետև սև կատուն անցնում է իր գործին։
common_voice_hy-AM_39473998.wav,Նկարը և նրա սյուժեն ենթարկվել են բազմաթիվ մեկնաբանությունների։
common_voice_hy-AM_39473999.wav,Տեղական փոքր վաճառակետերում և շուկաներում կարելի է ձեռք բերել կենդանի խխունջներ։
common_voice_hy-AM_39474000.wav,Էջմիածնի աշակերտներից և գյուղի բնակիչներից մի քանիսը անհայտանում են։
common_voice_hy-AM_39474065.wav,Դրա համար նա վարձում է կետորսորդական նավ։
common_voice_hy-AM_39474066.wav,Հորիզոնում հայտնվում է ամերիկյան նավ։
common_voice_hy-AM_39474068.wav,"Այստեղ բնակչության հիմնական զբաղմունքը գյուղատնտեսությունն է՝ երկրագործություն, անասնապահություն և այգեգործություն։"
common_voice_hy-AM_39474069.wav,Քաղաքացիական պատերազմը ամենադաժան փուլում է։
common_voice_hy-AM_39474092.wav,Նշանակում է «բոլորից մեծ»։
common_voice_hy-AM_39474094.wav,"Տղամարդկանց կմախքի ոսկրերն ավելի մասսիվ են, կրծքավանդակը լայն է, կոնքը՝ նեղ։"
common_voice_hy-AM_39474096.wav,Աջ ձեռքից կախված է ջարդած կուժ։
common_voice_hy-AM_39474098.wav,Իր գումարները թողել է բարեգործական ընկերություններին։
common_voice_hy-AM_39474099.wav,Սակայն ձգտումը զբաղվելու լրագրողական գործունեությամբ շատ ավելի ուժեղ գտնվեց։
common_voice_hy-AM_39474110.wav,Երեխաներից երեքն աշխատել են ստուդիայում։
common_voice_hy-AM_39474111.wav,Ասոցացվել է ծովագնացության հետ։
common_voice_hy-AM_39474113.wav,«Առկա քասթինգի» համար հրավիրվել են մոտ մեկուկես հազար երեխա։
common_voice_hy-AM_39474115.wav,"Համայնքի ավագանին ղեկավարի ներկայացմամբ հաստատում է համայնքի բյուջեն, վերահսկում՝ դրա կատարումը։"
common_voice_hy-AM_39474117.wav,"թե որ քիթդ դուր չեկավ, մեկ էլ տեսար տարավ ու բերեց - շրըխկ:"
common_voice_hy-AM_39474155.wav,Մի քանի երաժշտական մրցանակների թեկնածու և դափնեկիր է։
common_voice_hy-AM_39474157.wav,Բեովուլֆը վիկինգների ավանդության համաձայն թաղվում է այրվող նավում։
common_voice_hy-AM_39474160.wav,Լայնականջ աղվեսները մեծ մասամբ սնվում են տերմիտներով։
common_voice_hy-AM_39474162.wav,Իհարթը սկսել է նվագել թմբուկների վրա ավագ դպրոցում։
common_voice_hy-AM_39474182.wav,Շուտով վելուծելով իրավիճակը՝ կրկեսորդները ժամանակին փախչում են։
common_voice_hy-AM_39474185.wav,Նկարում պատկերված է ջրառատ գետի ոլորանն ամառային ամպամած օրը։
common_voice_hy-AM_39474189.wav,"Կողագիծը մինչև կորագիծը անընդհատ է, իսկ հետո ներկայացված է ընդհատվող հատվածներով։"
common_voice_hy-AM_39474191.wav,Նա բախվում է ձյունաթմբին և ընկնում է քարանձավ։
common_voice_hy-AM_39474209.wav,Բամբուկազգիներին բնորոշ է մեծ արագությամբ աճ։
common_voice_hy-AM_39474210.wav,Սիրել է շախմատ խաղալ։
common_voice_hy-AM_39474212.wav,"- Բայց ես շուտով մայր պետք է լինեմ,- հայտնեցի ես:"
common_voice_hy-AM_39474223.wav,Մեզ համար սա պարզապես կարգախոս չէ։
common_voice_hy-AM_39474224.wav,"Նա կանգ առավ պկամա և ինքն իրեն հարցրեց, թե ինչո՞ւ այդպես արեց."
common_voice_hy-AM_39474225.wav,Առանձնացվում է նաև մի անորոշ հոդ (մի գիրք)։
common_voice_hy-AM_39474226.wav,"Ուսուցչին պատմում է, որ պատրաստվում է ինքնասպան լինել։"
common_voice_hy-AM_39474227.wav,Այդ դերերի օգտագործումը չի հիշատակվել տիտրերում և չի եղել հաստատված։
common_voice_hy-AM_39474288.wav,"Վերջինս օգտագործում է այլ մոտեցում, բայց ունի նույն իմաստը։"
common_voice_hy-AM_39474289.wav,"Աթենացիների համար եղել է՝ ավազակ, իսկ մեգարցիների՝ զորապետ։"
common_voice_hy-AM_39474291.wav,Այն ամենամեծ և ամենաբարձր ժամացույցն է աշխարհում։
common_voice_hy-AM_39474292.wav,Մարմինս հողը պիտի ավերի:
common_voice_hy-AM_39474301.wav,Ավելի հին աղբյուր դեռևս չկա։
common_voice_hy-AM_39474302.wav,Աբեղան կուսակրոնության երդում է տալիս ձեռնադրության օրը՝ երեկոյան։
common_voice_hy-AM_39474303.wav,Գործած պատկերի բարդությունը որոշում էր բնակչի սոցիալական կարգավիճակը։
common_voice_hy-AM_39474304.wav,Էսսեն հայտնվել է բազմաթիվ հրապարակումներում և համացանցային ֆորումներում։
common_voice_hy-AM_39474305.wav,"Էրկու թումանն ի՞նչ ա, որ չես կարա միկից ճարի:"
common_voice_hy-AM_39474313.wav,Հետազոտություններից՝ կրծքավանդակի ռենտգեն քննությունը և վիրուսային տիպավորումը սովորաբար չեն անցկացվում։
common_voice_hy-AM_39474316.wav,Ֆինլանդացիները այդ օրը նախընտրում են նրբերշիկները և կարտոֆիլով աղցանը։
common_voice_hy-AM_39474317.wav,Սակայն այս ամենը չկասեցրեց գրքի տարածումը։
common_voice_hy-AM_39474352.wav,"Բոլշևիկներին հաջողվում է նավ բարձրանալ, զինաթափել նավապետին։"
common_voice_hy-AM_39474354.wav,Որոշ փաստեր ապացուցում են այս վարկածը։
common_voice_hy-AM_39474356.wav,"Նասերը նույնիսկ դադարեցրեց գաղտնի, ծածուկ շփումները։"
common_voice_hy-AM_39474358.wav,"Քաղաքը գտնվում է այն նույն վայրում, որտեղ հնում։"
common_voice_hy-AM_39474370.wav,"Թռչուններին բնորոշ է ձվադրումը, նրանց մոտ ամբողջությամբ բացակայում է ձվաբջիջը։"
common_voice_hy-AM_39474372.wav,Շիշկինի գրքերում հանդիպում ենք բազմաթիվ ակնարկներ իր սիրելի գրողների մասին։
common_voice_hy-AM_39474373.wav,"Հետագայում պարզվեց, որ այն և կոլումբիումը միևնույն տարրն են։"
common_voice_hy-AM_39474385.wav,Բլանշետի բեմական առաջին իսկ փորձն առաջ բերեց քննադատների հիացական արձագանքներ։
common_voice_hy-AM_39474386.wav,Գերագույն ռադայի արտաքին հարաբերությունների կոմիտեի արտաքին հարաբերությունների վերահսկողության հարցերով ենթակոմիտեի ղեկավար։
common_voice_hy-AM_39474387.wav,Սոցիալական պատմությունները ունեն հատուկ որոշված ոճ և ֆորմատ։
common_voice_hy-AM_39474388.wav,"Այսօր այն աշխարհի ամենախոշոր ամսագիրն է, որը վարում են ուսանողները։"
common_voice_hy-AM_39474389.wav,Ի սկզբանե հանդես է եկել պաշտպանի դիրքում։
common_voice_hy-AM_39474399.wav,Կը տարբերին ներքին եւ ընդհանուր (անկախ հարկից) ամպամածութեան տեսակներ։
common_voice_hy-AM_39474401.wav,Կռիլովի առակներից մի քանիսը թարգմանվել են նաև հայերեն տարբեր հեղինակների կողմից։
common_voice_hy-AM_39474413.wav,Ֆիլմը նկարահանվել է վիդեոօրագրի ձևաչափով։
common_voice_hy-AM_39474414.wav,Տարբեր պարբերություն ունեցող ցիկլային երևույթների պատճառով արևադարձի տեղը աստիճանաբար փոխվում է։
common_voice_hy-AM_39474417.wav,"Ծնվել է ոչ հայտնի ընտանիքում, ստացել է աստվածաբանական կրթություն։"
common_voice_hy-AM_39474423.wav,"- Դուք հիվա՞նդ եք, աղա Գրիգոր Մոսեիչ,- վերջապես հարցրեց նա դարձյալ:"
common_voice_hy-AM_39474424.wav,Նա գալիս է և սկզբում փորձում խմել միայն գազավորված ըմպելիք։
common_voice_hy-AM_39474425.wav,Մի քանի տարի անց զույգն ամուսնալուծվել է։
common_voice_hy-AM_39474426.wav,Հայաստան ինկաւ երկու հզօր կայսրութիւններու հակամարտութեան ոլորտին մէջ։
common_voice_hy-AM_39474431.wav,Աշխատակցել է սփյուռքահայ պարբերականներին։
common_voice_hy-AM_39474434.wav,Փիրուզը ոսկերչական գեղեցկագույն քարերից է և հայտնի է մարդկությանը հնուց։
common_voice_hy-AM_39474436.wav,"Մարկուսն ասում է, որ նա դա անտեսի։"
common_voice_hy-AM_39474442.wav,Սակայն հետագայում թողել է այդ զբաղմունքը՝ նվիրելով իրեն գրականությանը։
common_voice_hy-AM_39474444.wav,Ժամանակակից հիմնարար գեղանկարչության ներկայացուցիչ է։
common_voice_hy-AM_39474445.wav,Աշխատանքը կատարվում է կապալառուի կամ պատվիրատուի նյութերով։
common_voice_hy-AM_39474446.wav,Ընտրությունների ընթացքում մի քանի կուսակցություններ մեղադրվել են ձայներ գնելու մեջ։
common_voice_hy-AM_39474453.wav,Տուտուկները կ՚ըլլան երկու տեսակի՝ տիադոնիք և քրոմադիք։
common_voice_hy-AM_39474454.wav,Գրադարանն ունեցել բավականին ընթերցողներ։
common_voice_hy-AM_39474455.wav,Կաստորիա այցելող զբոսաշրջիկները անպայման շրջայց են կատարում լճի ափերով։
common_voice_hy-AM_39474456.wav,"Երբեմն «ֆելզիտ» տերմինը ընդգծվում է ապարի անվանման մեջ (օրինակ, ֆելզոդացիտ, ֆելզոֆիր)։"
common_voice_hy-AM_39474457.wav,Ստեղծագործել է դիմաքանդակի ժանրում։
common_voice_hy-AM_39474469.wav,"Մեծ ճանաչում ունի և՛ հեռուստատեսությունում, և՛ ռադիոյում։"
common_voice_hy-AM_39474471.wav,Այդ ընթացքում մարդն արտաքնապես առողջ է երևում։
common_voice_hy-AM_39474472.wav,Մրգերի հյութի սպառումը միջին հաշվով ավելանում է երկրի եկամտի մակարդակին զուգահեռ։
common_voice_hy-AM_39474677.wav,"Բաժանվում է լավային դաշտի, ալյուվիալ և նախալեռնային փոքրաթեք հարթությունների։"
common_voice_hy-AM_39474678.wav,"Հարգելի գործընկերներ, մինչ կառավարության նիստի օրակարգին անցնելն ուզում եմ անդրադարձ կատարել մի հարցի:"
common_voice_hy-AM_39474682.wav,"Ոչ մի տեղ երկար չի մնում, ապրում է վարձով տրվող սենյակներում։"
common_voice_hy-AM_39474694.wav,"Հեղուկ հելիումը, ջրածինը և նեոնը կիրառվում են կրիոգենային վակուումային տեխնիկայում։"
common_voice_hy-AM_39474695.wav,Մինչև եթեր դուրս գալը ալիքը շոուն փակել է։
common_voice_hy-AM_39474696.wav,ապա դարձավ Բազենյանին և շատ լուրջ կերպով նկատեց.
common_voice_hy-AM_39474699.wav,- Մինչև անգամ և ե՞ս…
common_voice_hy-AM_39474701.wav,Եվրոպական մշակույթի վառ ներկայացուցիչներից մեկն է։
common_voice_hy-AM_39474717.wav,Էլեկտրատեխնիկները սովորաբար ունեն էլեկտրատեխնիկայի կամ էլեկտրոնային ճարտարագիտության որակավորում։
common_voice_hy-AM_39474719.wav,"Գույնը՝ գորշ, տարբեր երանգներով։"
common_voice_hy-AM_39474721.wav,Աստիճանաբար վանական համալիրի շենքը սկսել է ավերվել։
common_voice_hy-AM_39474723.wav,"Նա դրեց յուր ձեռքը նրա կրծքին,- նա բաբախում էր,- յուր սիրելին տակավի՜ն կենդանի էր…"
common_voice_hy-AM_39474740.wav,Գյուղը ժամանակին եղել է գրչության կենտրոն։
common_voice_hy-AM_39474744.wav,Գալակտիկական կոորդինատային համակարգի հարթությունը համընկնում է գալակտիկայի սկավառակի հարթության հետ։
common_voice_hy-AM_39474746.wav,Ինքնաբուխ է իր ոճը եւ գունագեղ։
common_voice_hy-AM_39474748.wav,Այս ամուսնության ընթացքում ծնվել է մեկ կամ երկու երեխա։
common_voice_hy-AM_39474760.wav,Տոգոն համարձակ էր և հիանալի կողմնորոշվում էր։
common_voice_hy-AM_39474762.wav,Համակարգը այլեւս չվերականգնեցաւ։
common_voice_hy-AM_39474764.wav,"Գարֆիլդը պաշտպանում էր գյուղատնտեսական տեխնոլոգիաները, կրթված ընտրազանգվածը և աֆրոամերիկացիների քաղաքացիական իրավունքները։"
common_voice_hy-AM_39474766.wav,Նա գրել է լատիներեն պատարագ։
common_voice_hy-AM_39474768.wav,Թայսոնը ունեցել է նուրբ բնավորություն և չի կարողացել պաշտպանել իրեն։
common_voice_hy-AM_39474790.wav,Լանջերի լանդշաֆտը լեռնամարգագետնային է (ալպյան)։
common_voice_hy-AM_39474793.wav,Բայց մի օր այն անհետանում է։
common_voice_hy-AM_39474809.wav,Հարուստ է պտղատու և դեկորատիվ ծառերով։
common_voice_hy-AM_39474810.wav,Հաջորդ ամսում պարզ դարձավ ամբողջ դերասանական կազմը։
common_voice_hy-AM_39474811.wav,"Էյբելինին ազատում են աշխատանքից, և նա գնում է նոր կյանք փնտրելու։"
common_voice_hy-AM_39474813.wav,"Այն մարզիկը, որ կը մերժէ բժշկական քննութիւնը, կը ստանայ համապատասխան պատիժ։"
common_voice_hy-AM_39474814.wav,Ծնվել է գյուղական ընտանիքում։
common_voice_hy-AM_39474845.wav,Պավլովսկին հիմնել է մարդու հիվանդությունների վերաբերյալ բնական օջախայնոլթյան ուսմունքը։
common_voice_hy-AM_39474847.wav,Այս նոր դասի բևեռացման ռադիոմետրի համար ստացել է արտոնագիր։
common_voice_hy-AM_39474849.wav,Գործում է որպես պատմական թանգարան։
common_voice_hy-AM_39474853.wav,Հինգ տարին մեկ ցենտուրիական կոմիտիաներում ընտրվել է երկու ցենզոր։
common_voice_hy-AM_39474888.wav,"Պլատոնը էքստազը համարում է աստվածային զգացում, որը խորթ է երկրային զգացողություններին։"
common_voice_hy-AM_39474891.wav,Ձևավորել է ապարանքներ (պահպանվել են հատվածներ)։
common_voice_hy-AM_39474892.wav,"Վոլֆսբուրգը դանդաղ, սակայն կարողանում էր նախապատրաստվել հաջորդ մրցաշրջաններին։"
common_voice_hy-AM_39474898.wav,Սկզբնական սահմանման մեջ հնարավոր էր հետևյալ ընթացքը։
common_voice_hy-AM_39474899.wav,Մելանժը մատուցվում է մեկ բաժակ ջրով և երբեմն զարդարվում հարած սերուցքով։
common_voice_hy-AM_39474900.wav,Քաղքիկն ուներ քարաշեն եկեղեցի։
common_voice_hy-AM_39474901.wav,Խառնել և մատուցել։
common_voice_hy-AM_39474926.wav,"Կայքի հրապարակումները ներկայացվում էին երկու լեզուներով, անգլերեն և եբրայերեն։"
common_voice_hy-AM_39474927.wav,Նոր թագավորությունում աստվածուհուն երկրպագում էին որպես արևային աստվածություն։
common_voice_hy-AM_39474931.wav,"- Կարո՞ղ եմ նրան սպասել,- հարցրեց նա:"
common_voice_hy-AM_39474933.wav,Նուրբ կաշվե ձեռնոցներով և մորթե ձեռնամուշտակով է։
common_voice_hy-AM_39474953.wav,Վիլնյովի կլիման միջերկրածովային է։
common_voice_hy-AM_39474954.wav,Կերակուրների պատրաստման եղանակը բավական պարզ է։
